{"kind":"qualityProfile","id":"quality.phase6.shell","display_name":"Phase 6 Shell Quality Profile","hardware_profile_id":"hardware.win11.midrange","target_os":"Windows 11","cpu_class":"6-core desktop CPU","memory_gb":"16","storage_class":"SSD","gpu_class":"GTX 1660 / RX 580 class","fps_target":"60","frame_time_p95_ms":"20.0","cold_boot_budget_ms":"5000.0","transition_budget_ms":"2000.0","peak_working_set_budget_mb":"2048","ai_decision_p95_ms":"2.0","ui_panel_render_p95_ms":"1.0","single_save_budget_ms":"50.0","full_load_budget_ms":"250.0","full_save_budget_ms":"400.0","movement_acceleration_mps2":"18.0","movement_deceleration_mps2":"22.0","movement_jump_readability_scale":"1.0","movement_jump_buffer_ms":"100","movement_ledge_forgiveness_ms":"120","movement_companion_spacing_m":"4.0","camera_smoothing_strength":"0.55","camera_sensitivity_curve_exponent":"1.1","camera_shoulder_offset_m":"0.75","camera_follow_distance_m":"4.5","camera_pitch_degrees":"18.0","camera_motion_comfort_enabled":"true","combat_telegraph_window_ms":"650","combat_hit_stop_ms":"55","combat_low_health_threshold":"30","combat_line_of_fire_width_m":"1.25","combat_status_clarity_mode":"layered_icons","feedback_max_concurrent_world_cues":"8","feedback_max_critical_cues_per_beat":"2","feedback_required_families":"loot_reward,extraction,threat_escalation,companion_ack,workshop_success,creator_error,creator_success","feedback_priorities":"loot_reward:2,extraction:3,threat_escalation:3,companion_ack:1,workshop_success:2,creator_error:3,creator_success:2","subtitle_background_required":"true","high_contrast_required":"true","icon_redundancy_required":"true","motion_comfort_required":"true"}
